{
  "task_id": "T2-MA-1102",
  "practice_area": "ma",
  "client_context": "Client is a mid-size technology company acquiring a smaller competitor's assets. Review the asset purchase agreement from the Buyer side as Buyer's counsel. Buyer also needs earnout scenario revenue diligence reviewed.",
  "instruction": "Review the asset purchase agreement against the playbook. Flag deviations with exact quotes, propose fallback text where required, and escalate missing information.",
  "deliverable": {
    "card_schema_id": "redline-gym.issue-card.v1"
  },
  "turn_cap": 25,
  "difficulty_tier": "T2",
  "playbook_ref": "playbooks/ma/PB-MA-001.json"
}
