{
  "task_id": "T2-DPA-604",
  "practice_area": "privacy",
  "client_context": "Client is a mid-size tech company whose vendor will process customer personal data through a production workflow automation service. Review the DPA from the customer/controller side and escalate practical privacy or security gaps. The vendor will use subprocessors to process customer personal data for the production service.",
  "instruction": "Review the vendor DPA against the playbook. Flag deviations with exact quotes, propose fallback text where required, and escalate missing information.",
  "deliverable": {
    "card_schema_id": "redline-gym.issue-card.v1"
  },
  "turn_cap": 25,
  "difficulty_tier": "T2",
  "playbook_ref": "playbooks/privacy/PB-DPA-001.json"
}
